{"assurances":{"canonical_market_data_mutated":false,"canonical_publication_fully_verified":true,"history_campaign_receipts_verified":true,"instrument_registry_receipt_verified":true,"market_data_network_request_performed":false,"official_announcement_response_count":3,"private_endpoint_called":false},"bindings":{"instrument_registry_artifact_sha256":"9e78d2db1cebb33d1b1bf328df2dee3ee3ad9f7c3db6b42ae916c9017a0fa733","instrument_registry_content_sha256":"6b2c83a87e3fbb9921b89f25aca9d35f7f138c9a58c3d94ac8d0dad133495322","official_document_contract_sha256":"04e7f2c56cdcbd92abb0a2dc197440a88a823a22bb65a1d6dd00acfd20477543","publication_manifest_sha256":"ac7991b8cbbe249d8b299b91664a414aa81644a52f3ce4b87876eddf92d9e611","selected_instrument_set_sha256":"fe4d83f755b9db451a63ba0343a49370c50dc18d5240d85b1ca686da22e360de","software_identity":"git:7e5708a47b18896c694eb239da26a68232d0f4d0","source_campaign_manifest_sha256":"ae272dff8101577707af5f73785c8243381f7e97b335ffbc232db8b43f3a5379","source_campaign_plan_sha256":"d7b1eb16ed5e0a44c9749d7d2da7a8675506baf4186c7e75d0ddfc59cbb0343f"},"content_sha256":"b0d151ca78014ed2017f8ba34968df749271b4fa560c22fbcdce6489741494d7","contract":"grid.phase2-legacy-listing-event-evidence/v1","generated_at_utc":"2026-08-14T23:14:10.561582Z","limitations":["Official post timestamps are publication times, not guaranteed product activation times.","A first canonical candle is observed market-data coverage, not listing metadata.","One selected trade series begins two UTC dates before its related official post.","The current registry remains ex-post evidence, not historical point-in-time metadata.","This evidence does not accept absence, reclassify audits, remove blockers, open Gate 2, or authorize Phase 3."],"official_documents":[{"fetch_url":"https://t.me/s/Bybit_Announcements?before=73","matched_selected_instrument_count":1,"official_message_at_ms":1585152190000,"official_message_text_sha256":"7c7df2c0283606b8720ee7e3654b48a1f749f873d6b17de40d1375914ceef675","response_sha256":"1cca4142997b5afc61924997131ee3b3ea1064c7a78ac31a2b4e0e91892fb6ef","source_url":"https://t.me/Bybit_Announcements/72"},{"fetch_url":"https://t.me/s/Bybit_Announcements?before=313","matched_selected_instrument_count":3,"official_message_at_ms":1603277098000,"official_message_text_sha256":"042fafdcb125e98db2d885875621b17c225d7ec1e27fe2717bea7cbe140f2d55","response_sha256":"f366037b30c686edfaf7ec5802a01d50de3ef2f044957b75b0da05b0edf86213","source_url":"https://t.me/Bybit_Announcements/312"},{"fetch_url":"https://t.me/s/Bybit_Announcements?before=348","matched_selected_instrument_count":1,"official_message_at_ms":1608101734000,"official_message_text_sha256":"2a47ec996915dbdeae3c5ab59ef56c1108c93a8cfd9d88744f5f6995ef913e05","response_sha256":"7662c0689eaf26bd4a2de81de1a3ce9a1943088e3ee311c6f4134307654cfae4","source_url":"https://t.me/Bybit_Announcements/347"}],"quality":{"mark_first_candle":{"event_day_match_count":2,"event_month_match_count":5,"first_candle_after_event_day_count":0,"first_candle_before_event_day_count":3,"maximum_post_event_lag_days":0,"maximum_pre_event_lead_days":2},"official_document_count":3,"official_document_selected_match_count":5,"registry_launch_before_official_message_count":5,"selected_instrument_count":5,"trade_first_candle":{"event_day_match_count":4,"event_month_match_count":5,"first_candle_after_event_day_count":0,"first_candle_before_event_day_count":1,"maximum_post_event_lag_days":0,"maximum_pre_event_lead_days":2}},"source_policy":{"authentication":"none","exact_url_only":true,"maximum_response_bytes":1048576,"official_channel":"Bybit_Announcements","private_endpoints_called":false,"source_type":"official-public-telegram-post","transport_max_attempts_per_document":1},"status":"verified-four-exact-and-one-bounded-legacy-listing-event","storage_policy":{"account_data_included":false,"credentials_included":false,"instrument_identifiers_included":false,"market_timestamps_included":false,"market_values_included":false,"official_announcement_text_included":false,"official_announcement_timestamps_included":true,"official_announcement_urls_included":true,"runtime_paths_included":false}}
